{
  "OrderId": 500123,
  "Address": "string",
  "DeliveryNotes": "string",
  "StorePhoneNumber": "+353000000000",
  "AppIconUrl": "https://api.flipdish.co/example",
  "OrderTrackingCode": "string",
  "PaymentMethodDescription": "string",
  "LastFourDigits": "string",
  "OrderLines": [],
  "TotalAmount": 12.5,
  "Currency": "EUR",
  "Latitude": 1.0,
  "Longitude": 1.0,
  "Placed": "2026-06-02T12:00:00Z",
  "RequestedFor": "2026-06-02T12:00:00Z",
  "DriverId": 500123,
  "DriverName": "Example Name",
  "DriverImage": "string",
  "EstimatedMinutesForDelivery": 1
}